titulo,resumen
Introduction to Epilepsy,"Epilepsy is a neurological disorder characterized by recurrent seizures. These seizures are temporary episodes of abnormal electrical activity in the brain that can affect behavior, movements, sensations, and consciousness. Epilepsy is a neurological disorder characterized by recurrent seizures. These seizures are temporary episodes of abnormal electrical activity in the brain that can affect behavior, movements, sensations, and consciousness. Epilepsy is a neurological disorder characterized by recurrent seizures. These seizures are temporary episodes of abnormal electrical activity in the brain that can affect behavior, movements, sensations, and consciousness. Epilepsy is a neurological disorder characterized by recurrent seizures. These seizures are temporary episodes of abnormal electrical activity in the brain that can affect behavior, movements, sensations, and consciousness. Epilepsy is a neurological disorder characterized by recurrent seizures. These seizures are temporary episodes of abnormal electrical activity in the brain that can affect behavior, movements, sensations, and consciousness. Epilepsy is a neurological disorder characterized by recurrent seizures. These seizures are temporary episodes of abnormal electrical activity in the brain that can affect behavior, movements, sensations, and consciousness."
Current Treatments for Epilepsy,"The treatment of epilepsy typically includes anticonvulsant medications, but in resistant cases, options such as surgery, vagus nerve stimulation, or special diets like the ketogenic diet may be considered. The treatment of epilepsy typically includes anticonvulsant medications, but in resistant cases, options such as surgery, vagus nerve stimulation, or special diets like the ketogenic diet may be considered. The treatment of epilepsy typically includes anticonvulsant medications, but in resistant cases, options such as surgery, vagus nerve stimulation, or special diets like the ketogenic diet may be considered. The treatment of epilepsy typically includes anticonvulsant medications, but in resistant cases, options such as surgery, vagus nerve stimulation, or special diets like the ketogenic diet may be considered. The treatment of epilepsy typically includes anticonvulsant medications, but in resistant cases, options such as surgery, vagus nerve stimulation, or special diets like the ketogenic diet may be considered. The treatment of epilepsy typically includes anticonvulsant medications, but in resistant cases, options such as surgery, vagus nerve stimulation, or special diets like the ketogenic diet may be considered."
Causes of Epilepsy,"The causes of epilepsy are varied and include genetic factors, brain injuries, infections, and conditions such as stroke. However, in many cases, the exact cause cannot be determined. The causes of epilepsy are varied and include genetic factors, brain injuries, infections, and conditions such as stroke. However, in many cases, the exact cause cannot be determined. The causes of epilepsy are varied and include genetic factors, brain injuries, infections, and conditions such as stroke. However, in many cases, the exact cause cannot be determined. The causes of epilepsy are varied and include genetic factors, brain injuries, infections, and conditions such as stroke. However, in many cases, the exact cause cannot be determined. The causes of epilepsy are varied and include genetic factors, brain injuries, infections, and conditions such as stroke. However, in many cases, the exact cause cannot be determined. The causes of epilepsy are varied and include genetic factors, brain injuries, infections, and conditions such as stroke. However, in many cases, the exact cause cannot be determined."
Diagnosis of Epilepsy,"Diagnosis of epilepsy is performed through the patient's medical history, a neurological exam, and complementary tests such as electroencephalogram (EEG) and magnetic resonance imaging (MRI). Diagnosis of epilepsy is performed through the patient's medical history, a neurological exam, and complementary tests such as electroencephalogram (EEG) and magnetic resonance imaging (MRI). Diagnosis of epilepsy is performed through the patient's medical history, a neurological exam, and complementary tests such as electroencephalogram (EEG) and magnetic resonance imaging (MRI). Diagnosis of epilepsy is performed through the patient's medical history, a neurological exam, and complementary tests such as electroencephalogram (EEG) and magnetic resonance imaging (MRI). Diagnosis of epilepsy is performed through the patient's medical history, a neurological exam, and complementary tests such as electroencephalogram (EEG) and magnetic resonance imaging (MRI). Diagnosis of epilepsy is performed through the patient's medical history, a neurological exam, and complementary tests such as electroencephalogram (EEG) and magnetic resonance imaging (MRI)."
Living with Epilepsy,"Living with epilepsy can be challenging, but with proper treatment and social support, many individuals with epilepsy lead full and active lives. Living with epilepsy can be challenging, but with proper treatment and social support, many individuals with epilepsy lead full and active lives. Living with epilepsy can be challenging, but with proper treatment and social support, many individuals with epilepsy lead full and active lives. Living with epilepsy can be challenging, but with proper treatment and social support, many individuals with epilepsy lead full and active lives. Living with epilepsy can be challenging, but with proper treatment and social support, many individuals with epilepsy lead full and active lives. Living with epilepsy can be challenging, but with proper treatment and social support, many individuals with epilepsy lead full and active lives. Living with epilepsy can be challenging, but with proper treatment and social support, many individuals with epilepsy lead full and active lives."
Types of Epilepsy,"There are different types of epilepsy, such as focal epilepsy and generalized epilepsy, each with distinct clinical features and prognoses. There are different types of epilepsy, such as focal epilepsy and generalized epilepsy, each with distinct clinical features and prognoses. There are different types of epilepsy, such as focal epilepsy and generalized epilepsy, each with distinct clinical features and prognoses. There are different types of epilepsy, such as focal epilepsy and generalized epilepsy, each with distinct clinical features and prognoses. There are different types of epilepsy, such as focal epilepsy and generalized epilepsy, each with distinct clinical features and prognoses. There are different types of epilepsy, such as focal epilepsy and generalized epilepsy, each with distinct clinical features and prognoses. There are different types of epilepsy, such as focal epilepsy and generalized epilepsy, each with distinct clinical features and prognoses. There are different types of epilepsy, such as focal epilepsy and generalized epilepsy, each with distinct clinical features and prognoses."
Seizure Triggers,"Seizure triggers can include lack of sleep, stress, flashing lights, and alcohol consumption. Identifying and avoiding these triggers is part of epilepsy management. Seizure triggers can include lack of sleep, stress, flashing lights, and alcohol consumption. Identifying and avoiding these triggers is part of epilepsy management. Seizure triggers can include lack of sleep, stress, flashing lights, and alcohol consumption. Identifying and avoiding these triggers is part of epilepsy management. Seizure triggers can include lack of sleep, stress, flashing lights, and alcohol consumption. Identifying and avoiding these triggers is part of epilepsy management. Seizure triggers can include lack of sleep, stress, flashing lights, and alcohol consumption. Identifying and avoiding these triggers is part of epilepsy management. Seizure triggers can include lack of sleep, stress, flashing lights, and alcohol consumption. Identifying and avoiding these triggers is part of epilepsy management. Seizure triggers can include lack of sleep, stress, flashing lights, and alcohol consumption. Identifying and avoiding these triggers is part of epilepsy management."
Stigma and Epilepsy,"Epilepsy is a stigmatized condition in many cultures, leading to discrimination and social isolation for those affected. Epilepsy is a stigmatized condition in many cultures, leading to discrimination and social isolation for those affected. Epilepsy is a stigmatized condition in many cultures, leading to discrimination and social isolation for those affected. Epilepsy is a stigmatized condition in many cultures, leading to discrimination and social isolation for those affected. Epilepsy is a stigmatized condition in many cultures, leading to discrimination and social isolation for those affected. Epilepsy is a stigmatized condition in many cultures, leading to discrimination and social isolation for those affected. Epilepsy is a stigmatized condition in many cultures, leading to discrimination and social isolation for those affected. Epilepsy is a stigmatized condition in many cultures, leading to discrimination and social isolation for those affected. Epilepsy is a stigmatized condition in many cultures, leading to discrimination and social isolation for those affected."
Recent Research in Epilepsy,"Recent research is exploring new treatments for epilepsy, including gene therapies and new anticonvulsant drugs with fewer side effects. Recent research is exploring new treatments for epilepsy, including gene therapies and new anticonvulsant drugs with fewer side effects. Recent research is exploring new treatments for epilepsy, including gene therapies and new anticonvulsant drugs with fewer side effects. Recent research is exploring new treatments for epilepsy, including gene therapies and new anticonvulsant drugs with fewer side effects. Recent research is exploring new treatments for epilepsy, including gene therapies and new anticonvulsant drugs with fewer side effects. Recent research is exploring new treatments for epilepsy, including gene therapies and new anticonvulsant drugs with fewer side effects. Recent research is exploring new treatments for epilepsy, including gene therapies and new anticonvulsant drugs with fewer side effects. Recent research is exploring new treatments for epilepsy, including gene therapies and new anticonvulsant drugs with fewer side effects."
Childhood Epilepsy,"Childhood epilepsy addresses the diagnosis and treatment of epilepsy in children, considering the impact on cognitive and social development. Childhood epilepsy addresses the diagnosis and treatment of epilepsy in children, considering the impact on cognitive and social development. Childhood epilepsy addresses the diagnosis and treatment of epilepsy in children, considering the impact on cognitive and social development. Childhood epilepsy addresses the diagnosis and treatment of epilepsy in children, considering the impact on cognitive and social development. Childhood epilepsy addresses the diagnosis and treatment of epilepsy in children, considering the impact on cognitive and social development. Childhood epilepsy addresses the diagnosis and treatment of epilepsy in children, considering the impact on cognitive and social development. Childhood epilepsy addresses the diagnosis and treatment of epilepsy in children, considering the impact on cognitive and social development. Childhood epilepsy addresses the diagnosis and treatment of epilepsy in children, considering the impact on cognitive and social development."
Psychological Support,"Psychological support is crucial for epilepsy patients, helping them manage the stress and anxiety associated with the condition. Psychological support is crucial for epilepsy patients, helping them manage the stress and anxiety associated with the condition. Psychological support is crucial for epilepsy patients, helping them manage the stress and anxiety associated with the condition. Psychological support is crucial for epilepsy patients, helping them manage the stress and anxiety associated with the condition. Psychological support is crucial for epilepsy patients, helping them manage the stress and anxiety associated with the condition. Psychological support is crucial for epilepsy patients, helping them manage the stress and anxiety associated with the condition. Psychological support is crucial for epilepsy patients, helping them manage the stress and anxiety associated with the condition. Psychological support is crucial for epilepsy patients, helping them manage the stress and anxiety associated with the condition. Psychological support is crucial for epilepsy patients, helping them manage the stress and anxiety associated with the condition."
Treatment Adherence,"Adherence to treatment is critical in epilepsy to prevent seizures, but many patients face challenges in maintaining their medication regimen. Adherence to treatment is critical in epilepsy to prevent seizures, but many patients face challenges in maintaining their medication regimen. Adherence to treatment is critical in epilepsy to prevent seizures, but many patients face challenges in maintaining their medication regimen. Adherence to treatment is critical in epilepsy to prevent seizures, but many patients face challenges in maintaining their medication regimen. Adherence to treatment is critical in epilepsy to prevent seizures, but many patients face challenges in maintaining their medication regimen. Adherence to treatment is critical in epilepsy to prevent seizures, but many patients face challenges in maintaining their medication regimen. Adherence to treatment is critical in epilepsy to prevent seizures, but many patients face challenges in maintaining their medication regimen. Adherence to treatment is critical in epilepsy to prevent seizures, but many patients face challenges in maintaining their medication regimen."
Refractory Epilepsy,"Refractory epilepsy is epilepsy that does not respond to conventional treatments, requiring alternative therapeutic approaches. Refractory epilepsy is epilepsy that does not respond to conventional treatments, requiring alternative therapeutic approaches. Refractory epilepsy is epilepsy that does not respond to conventional treatments, requiring alternative therapeutic approaches. Refractory epilepsy is epilepsy that does not respond to conventional treatments, requiring alternative therapeutic approaches. Refractory epilepsy is epilepsy that does not respond to conventional treatments, requiring alternative therapeutic approaches. Refractory epilepsy is epilepsy that does not respond to conventional treatments, requiring alternative therapeutic approaches. Refractory epilepsy is epilepsy that does not respond to conventional treatments, requiring alternative therapeutic approaches. Refractory epilepsy is epilepsy that does not respond to conventional treatments, requiring alternative therapeutic approaches. Refractory epilepsy is epilepsy that does not respond to conventional treatments, requiring alternative therapeutic approaches. Refractory epilepsy is epilepsy that does not respond to conventional treatments, requiring alternative therapeutic approaches."
Seizure Classification,"Epileptic seizures can be classified into simple partial, complex partial, and generalized tonic-clonic seizures, each with specific symptoms. Epileptic seizures can be classified into simple partial, complex partial, and generalized tonic-clonic seizures, each with specific symptoms. Epileptic seizures can be classified into simple partial, complex partial, and generalized tonic-clonic seizures, each with specific symptoms. Epileptic seizures can be classified into simple partial, complex partial, and generalized tonic-clonic seizures, each with specific symptoms. Epileptic seizures can be classified into simple partial, complex partial, and generalized tonic-clonic seizures, each with specific symptoms. Epileptic seizures can be classified into simple partial, complex partial, and generalized tonic-clonic seizures, each with specific symptoms. Epileptic seizures can be classified into simple partial, complex partial, and generalized tonic-clonic seizures, each with specific symptoms. Epileptic seizures can be classified into simple partial, complex partial, and generalized tonic-clonic seizures, each with specific symptoms. Epileptic seizures can be classified into simple partial, complex partial, and generalized tonic-clonic seizures, each with specific symptoms."
Socioeconomic Impact,"The socioeconomic impact of epilepsy is significant, affecting work productivity and generating healthcare costs. The socioeconomic impact of epilepsy is significant, affecting work productivity and generating healthcare costs. The socioeconomic impact of epilepsy is significant, affecting work productivity and generating healthcare costs. The socioeconomic impact of epilepsy is significant, affecting work productivity and generating healthcare costs. The socioeconomic impact of epilepsy is significant, affecting work productivity and generating healthcare costs. The socioeconomic impact of epilepsy is significant, affecting work productivity and generating healthcare costs. The socioeconomic impact of epilepsy is significant, affecting work productivity and generating healthcare costs. The socioeconomic impact of epilepsy is significant, affecting work productivity and generating healthcare costs. The socioeconomic impact of epilepsy is significant, affecting work productivity and generating healthcare costs. The socioeconomic impact of epilepsy is significant, affecting work productivity and generating healthcare costs. The socioeconomic impact of epilepsy is significant, affecting work productivity and generating healthcare costs."
Epilepsy and Depression,"Epilepsy and depression often coexist, requiring an integrated approach to treatment to address both conditions. Epilepsy and depression often coexist, requiring an integrated approach to treatment to address both conditions. Epilepsy and depression often coexist, requiring an integrated approach to treatment to address both conditions. Epilepsy and depression often coexist, requiring an integrated approach to treatment to address both conditions. Epilepsy and depression often coexist, requiring an integrated approach to treatment to address both conditions. Epilepsy and depression often coexist, requiring an integrated approach to treatment to address both conditions. Epilepsy and depression often coexist, requiring an integrated approach to treatment to address both conditions. Epilepsy and depression often coexist, requiring an integrated approach to treatment to address both conditions. Epilepsy and depression often coexist, requiring an integrated approach to treatment to address both conditions. Epilepsy and depression often coexist, requiring an integrated approach to treatment to address both conditions."
Genetics of Epilepsy,"Genetics plays a role in some types of epilepsy, and specific genes increasing the risk of developing this disorder are being identified. Genetics plays a role in some types of epilepsy, and specific genes increasing the risk of developing this disorder are being identified. Genetics plays a role in some types of epilepsy, and specific genes increasing the risk of developing this disorder are being identified. Genetics plays a role in some types of epilepsy, and specific genes increasing the risk of developing this disorder are being identified. Genetics plays a role in some types of epilepsy, and specific genes increasing the risk of developing this disorder are being identified. Genetics plays a role in some types of epilepsy, and specific genes increasing the risk of developing this disorder are being identified. Genetics plays a role in some types of epilepsy, and specific genes increasing the risk of developing this disorder are being identified."
Nocturnal Seizures,Nocturnal seizures are common in epilepsy and can affect the quality of sleep for both the patient and their family members. Nocturnal seizures are common in epilepsy and can affect the quality of sleep for both the patient and their family members. Nocturnal seizures are common in epilepsy and can affect the quality of sleep for both the patient and their family members. Nocturnal seizures are common in epilepsy and can affect the quality of sleep for both the patient and their family members. Nocturnal seizures are common in epilepsy and can affect the quality of sleep for both the patient and their family members. Nocturnal seizures are common in epilepsy and can affect the quality of sleep for both the patient and their family members. Nocturnal seizures are common in epilepsy and can affect the quality of sleep for both the patient and their family members. Nocturnal seizures are common in epilepsy and can affect the quality of sleep for both the patient and their family members.
Safety and Epilepsy,"Epilepsy can influence activities such as driving and other tasks requiring constant attention, so precautions must be taken to ensure patient safety. Epilepsy can influence activities such as driving and other tasks requiring constant attention, so precautions must be taken to ensure patient safety. Epilepsy can influence activities such as driving and other tasks requiring constant attention, so precautions must be taken to ensure patient safety. Epilepsy can influence activities such as driving and other tasks requiring constant attention, so precautions must be taken to ensure patient safety. Epilepsy can influence activities such as driving and other tasks requiring constant attention, so precautions must be taken to ensure patient safety. Epilepsy can influence activities such as driving and other tasks requiring constant attention, so precautions must be taken to ensure patient safety. Epilepsy can influence activities such as driving and other tasks requiring constant attention, so precautions must be taken to ensure patient safety."
Effects of Stigma,The stigma associated with epilepsy can affect the self-esteem and interpersonal relationships of affected individuals. The stigma associated with epilepsy can affect the self-esteem and interpersonal relationships of affected individuals. The stigma associated with epilepsy can affect the self-esteem and interpersonal relationships of affected individuals. The stigma associated with epilepsy can affect the self-esteem and interpersonal relationships of affected individuals. The stigma associated with epilepsy can affect the self-esteem and interpersonal relationships of affected individuals. The stigma associated with epilepsy can affect the self-esteem and interpersonal relationships of affected individuals. The stigma associated with epilepsy can affect the self-esteem and interpersonal relationships of affected individuals. The stigma associated with epilepsy can affect the self-esteem and interpersonal relationships of affected individuals. The stigma associated with epilepsy can affect the self-esteem and interpersonal relationships of affected individuals. The stigma associated with epilepsy can affect the self-esteem and interpersonal relationships of affected individuals.
Fundamentals of Medical Ontologies,Medical ontologies are structured representations of knowledge that facilitate the integration and exchange of information among health systems. Medical ontologies are structured representations of knowledge that facilitate the integration and exchange of information among health systems. Medical ontologies are structured representations of knowledge that facilitate the integration and exchange of information among health systems. Medical ontologies are structured representations of knowledge that facilitate the integration and exchange of information among health systems. Medical ontologies are structured representations of knowledge that facilitate the integration and exchange of information among health systems. Medical ontologies are structured representations of knowledge that facilitate the integration and exchange of information among health systems. Medical ontologies are structured representations of knowledge that facilitate the integration and exchange of information among health systems. Medical ontologies are structured representations of knowledge that facilitate the integration and exchange of information among health systems. Medical ontologies are structured representations of knowledge that facilitate the integration and exchange of information among health systems.
