titulo,resumen
Ontology Creation Process,"Creating a medical ontology involves defining concepts, relationships, and rules that accurately and coherently reflect the health and medical domain. Creating a medical ontology involves defining concepts, relationships, and rules that accurately and coherently reflect the health and medical domain. Creating a medical ontology involves defining concepts, relationships, and rules that accurately and coherently reflect the health and medical domain. Creating a medical ontology involves defining concepts, relationships, and rules that accurately and coherently reflect the health and medical domain. Creating a medical ontology involves defining concepts, relationships, and rules that accurately and coherently reflect the health and medical domain. Creating a medical ontology involves defining concepts, relationships, and rules that accurately and coherently reflect the health and medical domain. Creating a medical ontology involves defining concepts, relationships, and rules that accurately and coherently reflect the health and medical domain. Creating a medical ontology involves defining concepts, relationships, and rules that accurately and coherently reflect the health and medical domain."
Interoperability in Health Systems,"Ontologies enhance interoperability between electronic health systems, enabling easier access and analysis of clinical data. Ontologies enhance interoperability between electronic health systems, enabling easier access and analysis of clinical data. Ontologies enhance interoperability between electronic health systems, enabling easier access and analysis of clinical data. Ontologies enhance interoperability between electronic health systems, enabling easier access and analysis of clinical data. Ontologies enhance interoperability between electronic health systems, enabling easier access and analysis of clinical data. Ontologies enhance interoperability between electronic health systems, enabling easier access and analysis of clinical data. Ontologies enhance interoperability between electronic health systems, enabling easier access and analysis of clinical data. Ontologies enhance interoperability between electronic health systems, enabling easier access and analysis of clinical data. Ontologies enhance interoperability between electronic health systems, enabling easier access and analysis of clinical data. Ontologies enhance interoperability between electronic health systems, enabling easier access and analysis of clinical data."
Clinical Applications of Ontologies,"A well-designed ontology can support applications such as clinical decision-making, computer-assisted diagnosis, and biomedical research. A well-designed ontology can support applications such as clinical decision-making, computer-assisted diagnosis, and biomedical research. A well-designed ontology can support applications such as clinical decision-making, computer-assisted diagnosis, and biomedical research. A well-designed ontology can support applications such as clinical decision-making, computer-assisted diagnosis, and biomedical research. A well-designed ontology can support applications such as clinical decision-making, computer-assisted diagnosis, and biomedical research. A well-designed ontology can support applications such as clinical decision-making, computer-assisted diagnosis, and biomedical research. A well-designed ontology can support applications such as clinical decision-making, computer-assisted diagnosis, and biomedical research. A well-designed ontology can support applications such as clinical decision-making, computer-assisted diagnosis, and biomedical research. A well-designed ontology can support applications such as clinical decision-making, computer-assisted diagnosis, and biomedical research. A well-designed ontology can support applications such as clinical decision-making, computer-assisted diagnosis, and biomedical research."
Tools for Ontology Development,"The ontology creation process includes requirement gathering, concept modeling, validation, and ongoing maintenance. The ontology creation process includes requirement gathering, concept modeling, validation, and ongoing maintenance. The ontology creation process includes requirement gathering, concept modeling, validation, and ongoing maintenance. The ontology creation process includes requirement gathering, concept modeling, validation, and ongoing maintenance. The ontology creation process includes requirement gathering, concept modeling, validation, and ongoing maintenance. The ontology creation process includes requirement gathering, concept modeling, validation, and ongoing maintenance. The ontology creation process includes requirement gathering, concept modeling, validation, and ongoing maintenance. The ontology creation process includes requirement gathering, concept modeling, validation, and ongoing maintenance. The ontology creation process includes requirement gathering, concept modeling, validation, and ongoing maintenance. The ontology creation process includes requirement gathering, concept modeling, validation, and ongoing maintenance. The ontology creation process includes requirement gathering, concept modeling, validation, and ongoing maintenance. The ontology creation process includes requirement gathering, concept modeling, validation, and ongoing maintenance."
Standard Medical Ontologies,Tools like Protégé are widely used for developing and managing ontologies in the medical field. Tools like Protégé are widely used for developing and managing ontologies in the medical field. Tools like Protégé are widely used for developing and managing ontologies in the medical field. Tools like Protégé are widely used for developing and managing ontologies in the medical field. Tools like Protégé are widely used for developing and managing ontologies in the medical field. Tools like Protégé are widely used for developing and managing ontologies in the medical field. Tools like Protégé are widely used for developing and managing ontologies in the medical field. Tools like Protégé are widely used for developing and managing ontologies in the medical field. Tools like Protégé are widely used for developing and managing ontologies in the medical field. Tools like Protégé are widely used for developing and managing ontologies in the medical field.
Shared Semantics in Health,"Standard medical ontologies, such as SNOMED CT and ICD, provide a common foundation for coding and exchanging clinical information. Standard medical ontologies, such as SNOMED CT and ICD, provide a common foundation for coding and exchanging clinical information. Standard medical ontologies, such as SNOMED CT and ICD, provide a common foundation for coding and exchanging clinical information. Standard medical ontologies, such as SNOMED CT and ICD, provide a common foundation for coding and exchanging clinical information. Standard medical ontologies, such as SNOMED CT and ICD, provide a common foundation for coding and exchanging clinical information. Standard medical ontologies, such as SNOMED CT and ICD, provide a common foundation for coding and exchanging clinical information. Standard medical ontologies, such as SNOMED CT and ICD, provide a common foundation for coding and exchanging clinical information. Standard medical ontologies, such as SNOMED CT and ICD, provide a common foundation for coding and exchanging clinical information."
Integration with EHR Systems,Shared semantics offered by ontologies facilitate the understanding and analysis of heterogeneous data from different sources. Shared semantics offered by ontologies facilitate the understanding and analysis of heterogeneous data from different sources. Shared semantics offered by ontologies facilitate the understanding and analysis of heterogeneous data from different sources. Shared semantics offered by ontologies facilitate the understanding and analysis of heterogeneous data from different sources. Shared semantics offered by ontologies facilitate the understanding and analysis of heterogeneous data from different sources. Shared semantics offered by ontologies facilitate the understanding and analysis of heterogeneous data from different sources. Shared semantics offered by ontologies facilitate the understanding and analysis of heterogeneous data from different sources. Shared semantics offered by ontologies facilitate the understanding and analysis of heterogeneous data from different sources. Shared semantics offered by ontologies facilitate the understanding and analysis of heterogeneous data from different sources. Shared semantics offered by ontologies facilitate the understanding and analysis of heterogeneous data from different sources.
Semantic Searching in Medicine,Integrating ontologies into Electronic Health Record (EHR) systems can improve the accuracy and efficiency of clinical documentation. Integrating ontologies into Electronic Health Record (EHR) systems can improve the accuracy and efficiency of clinical documentation. Integrating ontologies into Electronic Health Record (EHR) systems can improve the accuracy and efficiency of clinical documentation. Integrating ontologies into Electronic Health Record (EHR) systems can improve the accuracy and efficiency of clinical documentation. Integrating ontologies into Electronic Health Record (EHR) systems can improve the accuracy and efficiency of clinical documentation. Integrating ontologies into Electronic Health Record (EHR) systems can improve the accuracy and efficiency of clinical documentation. Integrating ontologies into Electronic Health Record (EHR) systems can improve the accuracy and efficiency of clinical documentation. Integrating ontologies into Electronic Health Record (EHR) systems can improve the accuracy and efficiency of clinical documentation. Integrating ontologies into Electronic Health Record (EHR) systems can improve the accuracy and efficiency of clinical documentation.
Semantic Interoperability,"Ontologies enable more effective semantic searches, enhancing the retrieval of relevant information in medical databases. Ontologies enable more effective semantic searches, enhancing the retrieval of relevant information in medical databases. Ontologies enable more effective semantic searches, enhancing the retrieval of relevant information in medical databases. Ontologies enable more effective semantic searches, enhancing the retrieval of relevant information in medical databases. Ontologies enable more effective semantic searches, enhancing the retrieval of relevant information in medical databases. Ontologies enable more effective semantic searches, enhancing the retrieval of relevant information in medical databases. Ontologies enable more effective semantic searches, enhancing the retrieval of relevant information in medical databases. Ontologies enable more effective semantic searches, enhancing the retrieval of relevant information in medical databases. Ontologies enable more effective semantic searches, enhancing the retrieval of relevant information in medical databases. Ontologies enable more effective semantic searches, enhancing the retrieval of relevant information in medical databases."
Collaboration in Ontology Development,"Semantic interoperability is a key challenge that medical ontologies aim to address, ensuring that different systems understand and use data consistently. Semantic interoperability is a key challenge that medical ontologies aim to address, ensuring that different systems understand and use data consistently. Semantic interoperability is a key challenge that medical ontologies aim to address, ensuring that different systems understand and use data consistently. Semantic interoperability is a key challenge that medical ontologies aim to address, ensuring that different systems understand and use data consistently. Semantic interoperability is a key challenge that medical ontologies aim to address, ensuring that different systems understand and use data consistently. Semantic interoperability is a key challenge that medical ontologies aim to address, ensuring that different systems understand and use data consistently. Semantic interoperability is a key challenge that medical ontologies aim to address, ensuring that different systems understand and use data consistently. Semantic interoperability is a key challenge that medical ontologies aim to address, ensuring that different systems understand and use data consistently."
Ontologies in Clinical Research,Collaboration between domain experts and developers is essential to create accurate and useful medical ontologies. Collaboration between domain experts and developers is essential to create accurate and useful medical ontologies. Collaboration between domain experts and developers is essential to create accurate and useful medical ontologies. Collaboration between domain experts and developers is essential to create accurate and useful medical ontologies. Collaboration between domain experts and developers is essential to create accurate and useful medical ontologies. Collaboration between domain experts and developers is essential to create accurate and useful medical ontologies. Collaboration between domain experts and developers is essential to create accurate and useful medical ontologies. Collaboration between domain experts and developers is essential to create accurate and useful medical ontologies. Collaboration between domain experts and developers is essential to create accurate and useful medical ontologies. Collaboration between domain experts and developers is essential to create accurate and useful medical ontologies.
Support for Artificial Intelligence,Ontologies support the implementation of data standards in clinical research and epidemiological studies. Ontologies support the implementation of data standards in clinical research and epidemiological studies. Ontologies support the implementation of data standards in clinical research and epidemiological studies. Ontologies support the implementation of data standards in clinical research and epidemiological studies. Ontologies support the implementation of data standards in clinical research and epidemiological studies. Ontologies support the implementation of data standards in clinical research and epidemiological studies. Ontologies support the implementation of data standards in clinical research and epidemiological studies. Ontologies support the implementation of data standards in clinical research and epidemiological studies. Ontologies support the implementation of data standards in clinical research and epidemiological studies. Ontologies support the implementation of data standards in clinical research and epidemiological studies. Ontologies support the implementation of data standards in clinical research and epidemiological studies. Ontologies support the implementation of data standards in clinical research and epidemiological studies.
Ontology Maintenance and Updates,The use of ontologies in medicine aids the development of artificial intelligence and machine learning by providing clear and well-defined knowledge structures. The use of ontologies in medicine aids the development of artificial intelligence and machine learning by providing clear and well-defined knowledge structures. The use of ontologies in medicine aids the development of artificial intelligence and machine learning by providing clear and well-defined knowledge structures. The use of ontologies in medicine aids the development of artificial intelligence and machine learning by providing clear and well-defined knowledge structures. The use of ontologies in medicine aids the development of artificial intelligence and machine learning by providing clear and well-defined knowledge structures. The use of ontologies in medicine aids the development of artificial intelligence and machine learning by providing clear and well-defined knowledge structures. The use of ontologies in medicine aids the development of artificial intelligence and machine learning by providing clear and well-defined knowledge structures.
Reusing Existing Ontologies,Medical ontologies can be adapted and expanded to include new discoveries and advancements in the health field. Medical ontologies can be adapted and expanded to include new discoveries and advancements in the health field. Medical ontologies can be adapted and expanded to include new discoveries and advancements in the health field. Medical ontologies can be adapted and expanded to include new discoveries and advancements in the health field. Medical ontologies can be adapted and expanded to include new discoveries and advancements in the health field. Medical ontologies can be adapted and expanded to include new discoveries and advancements in the health field. Medical ontologies can be adapted and expanded to include new discoveries and advancements in the health field. Medical ontologies can be adapted and expanded to include new discoveries and advancements in the health field. Medical ontologies can be adapted and expanded to include new discoveries and advancements in the health field.
Version Management in Ontologies,The quality and usability of a medical ontology depend on its ability to faithfully represent knowledge and relationships within the domain. The quality and usability of a medical ontology depend on its ability to faithfully represent knowledge and relationships within the domain. The quality and usability of a medical ontology depend on its ability to faithfully represent knowledge and relationships within the domain. The quality and usability of a medical ontology depend on its ability to faithfully represent knowledge and relationships within the domain. The quality and usability of a medical ontology depend on its ability to faithfully represent knowledge and relationships within the domain. The quality and usability of a medical ontology depend on its ability to faithfully represent knowledge and relationships within the domain. The quality and usability of a medical ontology depend on its ability to faithfully represent knowledge and relationships within the domain. The quality and usability of a medical ontology depend on its ability to faithfully represent knowledge and relationships within the domain.
Ontologies and the Semantic Web,Reusing existing ontologies can accelerate the development process and ensure consistency with recognized standards. Reusing existing ontologies can accelerate the development process and ensure consistency with recognized standards. Reusing existing ontologies can accelerate the development process and ensure consistency with recognized standards. Reusing existing ontologies can accelerate the development process and ensure consistency with recognized standards. Reusing existing ontologies can accelerate the development process and ensure consistency with recognized standards. Reusing existing ontologies can accelerate the development process and ensure consistency with recognized standards. Reusing existing ontologies can accelerate the development process and ensure consistency with recognized standards. Reusing existing ontologies can accelerate the development process and ensure consistency with recognized standards. Reusing existing ontologies can accelerate the development process and ensure consistency with recognized standards. Reusing existing ontologies can accelerate the development process and ensure consistency with recognized standards. Reusing existing ontologies can accelerate the development process and ensure consistency with recognized standards.
Impact of Medical Ontologies,Version management is important in creating medical ontologies to keep the knowledge representation up-to-date over time. Version management is important in creating medical ontologies to keep the knowledge representation up-to-date over time. Version management is important in creating medical ontologies to keep the knowledge representation up-to-date over time. Version management is important in creating medical ontologies to keep the knowledge representation up-to-date over time. Version management is important in creating medical ontologies to keep the knowledge representation up-to-date over time. Version management is important in creating medical ontologies to keep the knowledge representation up-to-date over time. Version management is important in creating medical ontologies to keep the knowledge representation up-to-date over time. Version management is important in creating medical ontologies to keep the knowledge representation up-to-date over time. Version management is important in creating medical ontologies to keep the knowledge representation up-to-date over time. Version management is important in creating medical ontologies to keep the knowledge representation up-to-date over time.
Evaluating Ontology Quality,Ontologies can be integrated with emerging technologies like the semantic web and open data services to drive innovation in healthcare. Ontologies can be integrated with emerging technologies like the semantic web and open data services to drive innovation in healthcare. Ontologies can be integrated with emerging technologies like the semantic web and open data services to drive innovation in healthcare. Ontologies can be integrated with emerging technologies like the semantic web and open data services to drive innovation in healthcare. Ontologies can be integrated with emerging technologies like the semantic web and open data services to drive innovation in healthcare. Ontologies can be integrated with emerging technologies like the semantic web and open data services to drive innovation in healthcare. Ontologies can be integrated with emerging technologies like the semantic web and open data services to drive innovation in healthcare. Ontologies can be integrated with emerging technologies like the semantic web and open data services to drive innovation in healthcare.
Healthcare Innovation with Ontologies,Impact analysis of medical ontologies allows evaluation of how they contribute to improving care quality and clinical process efficiency. Impact analysis of medical ontologies allows evaluation of how they contribute to improving care quality and clinical process efficiency. Impact analysis of medical ontologies allows evaluation of how they contribute to improving care quality and clinical process efficiency. Impact analysis of medical ontologies allows evaluation of how they contribute to improving care quality and clinical process efficiency. Impact analysis of medical ontologies allows evaluation of how they contribute to improving care quality and clinical process efficiency. Impact analysis of medical ontologies allows evaluation of how they contribute to improving care quality and clinical process efficiency. Impact analysis of medical ontologies allows evaluation of how they contribute to improving care quality and clinical process efficiency. Impact analysis of medical ontologies allows evaluation of how they contribute to improving care quality and clinical process efficiency.
